{
  "schema_version": "1.0",
  "artifact_kind": "design_only",
  "version": "scenario-design-v1",
  "timezone": "Asia/Shanghai",
  "core_count": 10,
  "entry_count": 11,
  "runtime_implemented": false,
  "public_enabled": false,
  "ai_policy": {
    "enabled": false,
    "may_compute_chart": false,
    "may_fill_missing_metrics": false,
    "requires_scenario_evaluation": true
  },
  "score_policy": {
    "status": "unavailable",
    "policy_id": null,
    "value": null,
    "note": "没有已核场景聚合权重；展示 —，不显示 0/60/默认好运或伪概率。"
  },
  "scenarios": [
    {
      "scenario_id": "daily_fortune",
      "title": "今日运势",
      "user_goal": "个人每日变化与复访",
      "entries": [
        {
          "entry_id": "daily_fortune",
          "label": "今日运势",
          "view": "default"
        }
      ],
      "period_kind": "day",
      "inputs": [
        {
          "name": "birth_profile",
          "label": "出生资料",
          "type": "birth_profile",
          "required": true,
          "note": "北京时间；出生时刻精度与规则口径单独记录。无时辰不猜测。"
        },
        {
          "name": "target_date",
          "label": "查看日期",
          "type": "date",
          "required": true,
          "note": ""
        }
      ],
      "dependencies": [
        {
          "engine_id": "bazi",
          "registered": false,
          "variant": null,
          "rule_ids": [],
          "role": "required",
          "scope": "待补强的八字执行契约",
          "invocation_condition": "满足本引擎输入/年界/非闰月要求"
        },
        {
          "engine_id": "ziwei",
          "registered": true,
          "variant": "quanshu-lunar-iztro-mutagen-v1",
          "rule_ids": [
            "ziwei.phase2.life_body",
            "ziwei.phase2.bureau",
            "ziwei.phase2.palaces",
            "ziwei.phase2.major_stars",
            "ziwei.phase2.auxiliary_stars",
            "ziwei.phase2.mutagens"
          ],
          "role": "supporting",
          "scope": "基础结构；不是场景判读规则",
          "invocation_condition": "满足本引擎输入/年界/非闰月要求"
        }
      ],
      "scenario_rules": [],
      "evidence": {
        "existing_structural_refs": [
          {
            "engine_id": "ziwei",
            "rule_id": "ziwei.phase2.life_body",
            "audit_ref": "config/scenarios/capability_snapshot.json#/engines/5/rules/0",
            "grades": [
              "C"
            ]
          },
          {
            "engine_id": "ziwei",
            "rule_id": "ziwei.phase2.bureau",
            "audit_ref": "config/scenarios/capability_snapshot.json#/engines/5/rules/1",
            "grades": [
              "C"
            ]
          },
          {
            "engine_id": "ziwei",
            "rule_id": "ziwei.phase2.palaces",
            "audit_ref": "config/scenarios/capability_snapshot.json#/engines/5/rules/2",
            "grades": [
              "C"
            ]
          },
          {
            "engine_id": "ziwei",
            "rule_id": "ziwei.phase2.major_stars",
            "audit_ref": "config/scenarios/capability_snapshot.json#/engines/5/rules/3",
            "grades": [
              "C"
            ]
          },
          {
            "engine_id": "ziwei",
            "rule_id": "ziwei.phase2.auxiliary_stars",
            "audit_ref": "config/scenarios/capability_snapshot.json#/engines/5/rules/4",
            "grades": [
              "C"
            ]
          },
          {
            "engine_id": "ziwei",
            "rule_id": "ziwei.phase2.mutagens",
            "audit_ref": "config/scenarios/capability_snapshot.json#/engines/5/rules/5",
            "grades": [
              "C"
            ]
          }
        ],
        "scenario_conclusion_refs": [],
        "required_new_knowledge": [
          "场景判读与聚合依据"
        ]
      },
      "maturity": "blocked_bazi",
      "status": "blocked",
      "public_enabled": false,
      "runtime_implemented": false,
      "ai_enabled": false,
      "report_template": "scenario-report-v1",
      "score_policy_id": null,
      "forecast_available": false,
      "current_limit": "运势趋势尚未可算；可以展示日历事实，不能称为个人好运",
      "blockers": [
        "四柱/流日",
        "场景解释规则",
        "历史与复访服务"
      ],
      "priority": null,
      "history": {
        "supported_now": false,
        "design_key": [
          "owner_id",
          "scenario_id",
          "view",
          "profile_versions",
          "period_start",
          "period_end",
          "registry_version",
          "engine_versions",
          "rule_versions",
          "input_digest"
        ],
        "periodic_revisit": true,
        "on_version_change": "new_revision_preserve_old",
        "reroll_on_refresh": false
      }
    },
    {
      "scenario_id": "weekly_fortune",
      "title": "本周运势",
      "user_goal": "一周关注点和日程复盘",
      "entries": [
        {
          "entry_id": "weekly_fortune",
          "label": "本周运势",
          "view": "default"
        }
      ],
      "period_kind": "week",
      "inputs": [
        {
          "name": "birth_profile",
          "label": "出生资料",
          "type": "birth_profile",
          "required": true,
          "note": "北京时间；出生时刻精度与规则口径单独记录。无时辰不猜测。"
        },
        {
          "name": "week_start",
          "label": "本周周一",
          "type": "date",
          "required": true,
          "note": ""
        }
      ],
      "dependencies": [
        {
          "engine_id": "bazi",
          "registered": false,
          "variant": null,
          "rule_ids": [],
          "role": "required",
          "scope": "待补强的八字执行契约",
          "invocation_condition": "满足本引擎输入/年界/非闰月要求"
        },
        {
          "engine_id": "ziwei",
          "registered": true,
          "variant": "quanshu-lunar-iztro-mutagen-v1",
          "rule_ids": [
            "ziwei.phase2.life_body",
            "ziwei.phase2.bureau",
            "ziwei.phase2.palaces",
            "ziwei.phase2.major_stars",
            "ziwei.phase2.auxiliary_stars",
            "ziwei.phase2.mutagens"
          ],
          "role": "supporting",
          "scope": "基础结构；不是场景判读规则",
          "invocation_condition": "满足本引擎输入/年界/非闰月要求"
        }
      ],
      "scenario_rules": [],
      "evidence": {
        "existing_structural_refs": [
          {
            "engine_id": "ziwei",
            "rule_id": "ziwei.phase2.life_body",
            "audit_ref": "config/scenarios/capability_snapshot.json#/engines/5/rules/0",
            "grades": [
              "C"
            ]
          },
          {
            "engine_id": "ziwei",
            "rule_id": "ziwei.phase2.bureau",
            "audit_ref": "config/scenarios/capability_snapshot.json#/engines/5/rules/1",
            "grades": [
              "C"
            ]
          },
          {
            "engine_id": "ziwei",
            "rule_id": "ziwei.phase2.palaces",
            "audit_ref": "config/scenarios/capability_snapshot.json#/engines/5/rules/2",
            "grades": [
              "C"
            ]
          },
          {
            "engine_id": "ziwei",
            "rule_id": "ziwei.phase2.major_stars",
            "audit_ref": "config/scenarios/capability_snapshot.json#/engines/5/rules/3",
            "grades": [
              "C"
            ]
          },
          {
            "engine_id": "ziwei",
            "rule_id": "ziwei.phase2.auxiliary_stars",
            "audit_ref": "config/scenarios/capability_snapshot.json#/engines/5/rules/4",
            "grades": [
              "C"
            ]
          },
          {
            "engine_id": "ziwei",
            "rule_id": "ziwei.phase2.mutagens",
            "audit_ref": "config/scenarios/capability_snapshot.json#/engines/5/rules/5",
            "grades": [
              "C"
            ]
          }
        ],
        "scenario_conclusion_refs": [],
        "required_new_knowledge": [
          "场景判读与聚合依据"
        ]
      },
      "maturity": "blocked_bazi",
      "status": "blocked",
      "public_enabled": false,
      "runtime_implemented": false,
      "ai_enabled": false,
      "report_template": "scenario-report-v1",
      "score_policy_id": null,
      "forecast_available": false,
      "current_limit": "不能把七天伪分数平均成周运势",
      "blockers": [
        "流日/流月联动",
        "周报告聚合规则",
        "历史与复访服务"
      ],
      "priority": null,
      "history": {
        "supported_now": false,
        "design_key": [
          "owner_id",
          "scenario_id",
          "view",
          "profile_versions",
          "period_start",
          "period_end",
          "registry_version",
          "engine_versions",
          "rule_versions",
          "input_digest"
        ],
        "periodic_revisit": true,
        "on_version_change": "new_revision_preserve_old",
        "reroll_on_refresh": false
      }
    },
    {
      "scenario_id": "monthly_fortune",
      "title": "本月运势",
      "user_goal": "本月主题、分段与回顾",
      "entries": [
        {
          "entry_id": "monthly_fortune",
          "label": "本月运势",
          "view": "default"
        }
      ],
      "period_kind": "month",
      "inputs": [
        {
          "name": "birth_profile",
          "label": "出生资料",
          "type": "birth_profile",
          "required": true,
          "note": "北京时间；出生时刻精度与规则口径单独记录。无时辰不猜测。"
        },
        {
          "name": "target_month",
          "label": "查看月份",
          "type": "month",
          "required": true,
          "note": ""
        }
      ],
      "dependencies": [
        {
          "engine_id": "bazi",
          "registered": false,
          "variant": null,
          "rule_ids": [],
          "role": "required",
          "scope": "待补强的八字执行契约",
          "invocation_condition": "满足本引擎输入/年界/非闰月要求"
        },
        {
          "engine_id": "ziwei",
          "registered": true,
          "variant": "quanshu-lunar-iztro-mutagen-v1",
          "rule_ids": [
            "ziwei.phase2.life_body",
            "ziwei.phase2.bureau",
            "ziwei.phase2.palaces",
            "ziwei.phase2.major_stars",